[
  {
    "tenant_id": "demo",
    "source_id": "bank-demo",
    "source_role": "bank",
    "canonical_uri": "urn:synthetic:bank:aluminium:1",
    "title": "Учебная аналитическая заметка, не позиция Альфа-Банка",
    "content": "Синтетическая банковская заметка для теста. Алюминий и сроки поставки следует оценивать с учётом запасов и условий конкретного договора. Это учебный текст, он не является позицией какого-либо банка.",
    "content_type": "text/plain",
    "published_at": "2026-10-24T08:00:00Z",
    "fetched_at": "2026-10-24T10:00:00Z",
    "synthetic": true,
    "publisher": "Учебный источник"
  }
]
